{
  "schema_version": "tools-publication-projection/1.0.0",
  "manual_id": "tools",
  "release_status": "unapproved-projection-verified",
  "owner_subepic": 4728,
  "authority_repository": "D-sorganization/Tools",
  "catalog_repository": "D-sorganization/Engineering-Design-Manuals",
  "repository_license": "MIT",
  "private_content_allowed": false,
  "evidence": {
    "immutable_source_commit": "b7a96fbf76513bd6e03772a2b93d1d398a93ae03",
    "source_tree_sha256": "cd7cd79c8e097b4e83c15610af795bf9d4382d1e",
    "calculation_registry_sha256": "67fbf0697e4678afb88e146f39b6bb8e5bfe8b5e975afb039f1e616bc09017a6",
    "toolchain_lock_sha256": "62915da70f09da3fead98ae71ccb94c2afaec7db2de390faa97234e103426b9b",
    "artifact_sha256": {
      "docx": {
        "path": "manuals/tools/dist/tools-engineering-design-manual.docx",
        "media_type": "application/vnd.openxmlformats-officedocument.wordprocessingml.document",
        "bytes": 73789,
        "sha256": "4089d9766ee595ace553f01bb6644e81ee54130df27fab1994878c4193027464"
      },
      "html": {
        "path": "manuals/tools/dist/tools-engineering-design-manual.html",
        "media_type": "text/html",
        "bytes": 106378,
        "sha256": "5760e567ea28508f07cd025e95fb6d9e1f36b9f99b52daa3379b79b059152df4"
      },
      "pdf": {
        "path": "manuals/tools/dist/tools-engineering-design-manual.pdf",
        "media_type": "application/pdf",
        "bytes": 286808,
        "sha256": "5ad05de7dd340873eb8f39c4ec3be22cee5ba1de7da13816fe55a8ad7b1e9779"
      },
      "tex": {
        "path": "manuals/tools/dist/tools-engineering-design-manual.tex",
        "media_type": "application/x-tex",
        "bytes": 44879,
        "sha256": "36eac866e332adcd7692b772beb449badb55f55b3483d399fc3eef2547f4c264"
      }
    },
    "semantic_parity": "verified-semantic-parity",
    "pdf_page_review": {
      "path": "manuals/tools/dist/tools-engineering-design-manual.pdf",
      "page_count": 12,
      "uninspected_pages": 0,
      "inspection_mode": "complete-zero-sampling",
      "sampling_rate": 1.0,
      "status": "verified"
    },
    "docx_page_review": {
      "path": "manuals/tools/dist/tools-engineering-design-manual.docx",
      "paragraph_count": 205,
      "heading_count": 77,
      "math_element_count": 52,
      "table_count": 1,
      "drawing_count": 1,
      "bookmark_count": 82,
      "unresolved_reference_count": 0,
      "status": "verified"
    },
    "accessibility_review": {
      "html_path": "manuals/tools/dist/tools-engineering-design-manual.html",
      "has_lang": true,
      "has_viewport": true,
      "mathml_block_count": 52,
      "images_with_valid_alt": 1,
      "images_missing_alt": 0,
      "unresolved_reference_count": 0,
      "status": "verified"
    },
    "human_approval": {
      "state": "blocked-pending-human-approval",
      "blocker_id": "TOOLS-HUMAN-APPROVAL-PENDING",
      "review_boundary": "zero-sampling-page-review-and-accessibility-verified"
    }
  },
  "blockers": [
    {
      "id": "TOOLS-HUMAN-APPROVAL-PENDING",
      "owner": "Lead systems maintainers",
      "resolution": "Publication projection remains blocked pending formal human sign-off on page and accessibility review."
    },
    {
      "id": "TOOLS-CATALOG-SYNC-PENDING",
      "owner": "D-sorganization/Engineering-Design-Manuals maintainers",
      "resolution": "Projection manifest ready for sync into catalog repository once released."
    }
  ]
}
